{
  "check_id": "prototype-build-repaired",
  "why_now": "The bounded developer repair reports success, so the dispatcher must independently execute the real frontend build before the prototype can be saved or opened for browser acceptance.",
  "working_directory": "frontend",
  "argv": [
    "npm",
    "run",
    "build"
  ],
  "timeout_seconds": 1800,
  "expected_exit_codes": [
    0
  ],
  "env_refs": []
}
